1443	5	a	This dress has special written all over it. the poms at the hem and bodice, as well as the rows of black seed beads push are the kind of details that stand out. i like all the varying textures. it looks great with sandals or short boots. fits true to size. a nice sassy length.
1444	4	a	I love pilcro jeans and usually wear the stet fit. this is the first pair that i've owned that had so much stretch. they stretch and do lose their shape slightly, but bounce back after a wash. my main complaint may be stretch-related: after the first wear, the inner thigh area was covered in pills. granted, my inner thighs touch when i walk, but this has never happened with any other pair of pilcro that i've owned. i still have a pair of black stet that i bought 4yrs ago and they've never shown
1445	5	a	"I've been searching for a pretty & soft faux fur coat - finally found it hanging there in retailer! there was only one - a size small. it looked gorgeous, but thought i could use it a bit roomier. i'm a size 2/4, 5'5"" & about 118 lbs. i ordered a medium but it was huge. stayed with the small and am loving wearing this in our mild northeast winter. lots of compliments. lightweight and luxe. get it."
1446	4	a	Very cute and true to size if not just a little large up top.
1447	5	a	The stylist at my local retailer recommended i try this dress and it did not disappoint!  the material is fabulous and it looks exactly as pictured on the model.  it also has pockets which is a bonus to me.  i normally wear a 4 but bought a 6 in this dress - i am a 34c and i felt the 4 was a little tight across the chest - otherwise i feel the dress is pretty much true to size.
1448	5	a	It does run large. i got it on sale and it is a great sweater / coat for $200.00. i would not have paid the full price of 450.00 but i do love it. every time i wear it someone complements me.
1449	5	a	"This is a really beautiful kimono. soft and flattering. as well as eye catching. can be dressed up or down. absolutely recommend"
1450	3	a	I was so excited to receive this in the mail as it had been on backorder for awhile. the dress is beautiful, but run smalls the buttons on the back are nearly impossible to fasten. if you are single, good luck trying to get it buttoned. i'll be returning it.
1451	4	a	Great top for everyday wear. runs a little large as i usually for size medium and i bought a small. a tiny bit see through but i think i can get away without wearing a tank underneath.
1452	5	a	This is a darling dress at this price point. i tried some of the more expensive options in the off-the-shoulder dresses this season and this one is as flattering and as well constructed as the others. the fabric is light but it is not sheer. it is smooth with a bit of a sheen. it is airy but not drapey like a rayon would be. i would describe it as a lawn. upon arrival the packaging indicated that it is considered a 'cover-up'. the site did not describe it that way but it may explain the comparat
1453	5	a	When i got this skirt i figured it was a muted sweater skirt. what i got was a much fancier sparkly sweater skirt. the blue is more of a bright sparkly teal and gold thread is woven throughout. oh my it's spectacular. really beautiful.
1454	2	a	I thought i would love this shirt because it goes along with my style, but i returned it immediately. it runs so large! the colors are faded, and the trim of the shirt curl over, so it looks cheap and frumpy. i do not recommend this! it hits in all the wrong places.
1455	5	a	"I was looking for a layering piece to go over leggings or skinny jean to cover my backside. i really like this swingy top. i agree that it does run large but i was looking for something flowy so i love it. the cream is a litttle more sheer than i expected so i'm wearing a cami underneath. maybe being taller 5' 8"" helps it not seem so much like a tent. well made and just what i thought it would be from the website model photo. (i used a 20% coupon so help easy the pain of the price of this top -"
1456	5	a	"Great shirt to wear with white pants and wedges. i'm a teacher and this is perfect for warmer months for school or for casual evening out. it runs big but falls in such a way that it doesn't make the wearer look big; it falls elegantly and in a flattering way.  great, versatile shirt."
1457	2	a	"In the words of my husband, ""looks like you're wearing a bag."" i'm althetic and short. maybe this works best on tall and very slim?"
1458	5	a	Love this top so much that i bought it in both colors. the fabric is wonderful and the pleated front is a nice feature. i also like the fabric covered buttons. you can button this top all the way or leave the top few buttons undone. either way, it looks cute. i especially like that it looks great under a blazer or cardigan and will look good uncovered when the weather heats up. great quality and features for the price.
1459	4	a	I like the way the skirt of the dress swings when you move. in order to get the arm holes to not be too low, i ended up with the smaller of the two sizes i usually buy. i also appreciate the dress has pockets and the soft fabric. the tag says you can machine wash cold gentle which is also a plus!
1460	4	a	Even though i had to return this top because it did not fit me properly, it's a very nicely made and attractive piece with a lot of versatility.
1461	3	a	Love the feel and comfort
1462	5	a	I bought one of these as a gift for a friend and i loved it so much i had to get one for myself! it's beautiful material and has lovely detail, a little sheer so best worn with a cami underneath. probably better for those with not too ample busts as it doesn't have a lot of stretch.
1463	2	a	"The design/shape of the dress are quite flattering, flirty and feminine. but.... there is no way that the dress i received is new. the color is a faded washed out red and there are black stains all over the belt area. there is no tag... the fabric looks droopy and laundered and is not crisp, stiff or new. i am very disappointed by the quality of the item that i received. undoubtedly this one is going back.  dear retailer - please make sure that you do not send pre-owend clothing articles to"
1464	3	a	Bought this in the store and fell in love with it. very soft and flattering to wear. however, after wearing it one day it is already starting to pill. this truly is a beautiful sweater, but i fear it will not be beautiful for long. i am willing to take the chance as i got it on sale.
1465	3	a	I couldn't get this to work for me. tried a variety of sizes and just couldn't get it to flow right. didn't purchase.
1466	5	a	Seems like all i wear all summer are solid colored tees with shorts or skirts. decided this summer i would have patterns! and color! this is a great t-shirt. nice weight. pretty pattern. i found the length on the small to fit my frame perfectly. an xs probably would be good too, but i hate having my favorite t-shirts shrink to unwearable so i always start a little bigger.
1467	5	a	Love this tee. it has a drapery cut which i love. the only thing i found was that it ran a bit smaller.
1468	5	a	"Drapes very nicely and runs true to size. easy to wear alone or layer a jacket/cardigan over. i purchased this on sale, and it was a good buy. i am 5'8"" and purchased the size m, as i am a pretty true size 6."
1469	5	a	I bought this top in navy and am so happy with my purchase. it's pretty and feminine. it looks great with jeans as well dressing it up for work. very happy with this purchase.
1470	5	a	I really love this shirt and bought it in several colors. i wish it came in white and in black because it's a great basic. i think it also works well for business casual attire.
1471	1	a	I wanted to like this one.. really but it was just plain sloppy looking. i returned it.
1472	4	a	Lovely embroidery with a classic look, great addition to your wardrobe.
1473	4	a	I love this dress! it is comfortable and pretty, well made and classic. it edges toward the larger size however it is supposed to be big. i got a small and at first it looked too big but the shoulders are perfect. i feel like sissy spacek in this gown and you will also!
1474	5	a	These cords are great, the fit, the style, everything! my new favorite fall pants!
1475	5	a	This is one of the best things i have ever bought from anrtho. it is very flattering, and i always get compliments when i wear it. must have!
1476	3	a	I loved the look of this shirt but full price was a little steep so i waited for it to go on sale and am glad i waited because only a l was left and it was perfect fit since i originally was thinkng of getting a small or medium which i usually do at retailer but this one was running really small compared to retailer other shirts. the fabric is great but when i looked at it carefully, the zipper construction is sewn poorly as well as the sewing at the buttons area...also, there were a lot of thread h
1477	4	a	I sized up to an xl and although they have everything you want in a yoga/lounge pant, they just didn't thrill me enough to keep them. they're soft, warm and comfy but i didn't care for the bulk or fit of the foldover waistband. and they were too long so i returned. if you're built like the model, you'll love these.
1478	5	a	"I love this tank - the colors are great and the fit is flattering. the fabric is lightweight but not cheap or so thin that you need to wear something under it. i am 5'7"" and the length was fine for me."
1479	5	a	"I saw this dress online first and suspected i would like it, but the price scared me away. then, while visiting in portland, i saw it on sale at an retailer store. when i came out of the dressing room to look in a bigger mirror the store clerk said, ""well that's a no-brainer!"" i thought the same thing. i love this dress so much i actually would have paid full price for it. it's super fun and easy to wear; i paired it with navy blute tights and suede ankle booties. i'm 5'6, 138 lbs and the m"
1480	4	a	I ordered a regular size 6 because the petite size 6 was sold out. it was too large for me; maybe the 4 would have worked. in part because the size was off, it looked frumpy on me with the poofs and flowers. however, i did like that it is cotton and has its own beige-colored slip that snaps on at the shoulders. i have no doubt this could look very nice on someone if the size was just right.. i like the black crochet-type details.
1481	5	a	This is my favorite top! it is gorgeous, soft, & oh so comfortable. it's not too tight & works with leggings, jeans, or as an over-shirt. love it!
1482	5	a	"I bought these pants in red after trying them on in store. they are soft and company. they have a loose fit, which is typical for chinos, so they pair best with a fitted top. i'm 5'2"""" and these were the perfect length when rolled. they run a bit big and stretch out though and eventually were too baggy. i loved them though so i ordered them in a size down. i'd definitely buy them in other colors too if they become available in my size!"
1483	4	a	Beautiful dress, but works best with a belt where the dress cinches at the high waist. it runs huge: i'm 5'6 and a m/l but the small petite is what looks and fits the best. there is a lot of unnecessary fabric and stretch at the waist. i received a lot of compliments on this dress! glad i kept trying on smaller sizes.
1484	3	a	"I love cloth and stone and the softness and prettiness of this fabric did not disappoint. this is not a dress, however. it is a long shirt. the sides were so short the you could see where my bum and hamstrings came together. leggings would ruin the look and as a shirt it would be totally impractical. for reference i am 5'8"" and 130 lbs. the small was the correct size, save for the length."
1485	4	a	These are thicker and don't have as much stretch, needed to go up from my usual 26 to a 27. good for late summer to fall transition due to the wash.
1486	4	a	The blue color is beautiful and what attracted me to this sweater. the draped front is very flattering and the fit is true to size. unfortunately the banded hem creates a pouching effect that is very unflattering. i really wanted to love this sweater, but just can't figure out how to wear it without poofing. i think this is the reason it is tucked in in many of the model shots. it is still a pretty sweater and it may work with for some.
1487	5	a	Fit is boxy yet flattering and material is sheer but not overly delicate. took my usual size four, i am moderately short waisted.
1488	5	a	Such an easy to wear and nicely cut summer dress. it does not wrinkle, has pretty colors and fits very well. i haven't washed it yet, but i like the idea that it can be machine washed. highly recommend. the fabric is good quality, a little bit thick for hot days though.
1489	5	a	I love this dress! i was trying on some dresses in the store and the sales girl put this one in just for fun. i would have never picked this dress out. i didn't look awesome on the hanger. but i tried it on anyway and i ended up getting two other dresses at that time. but i couldn't stop thinking about how much i loved the way i looked and felt in this dress. so i did what any girl would do and bought it online. it took me a while to find it online because the picture on line doesn't do the dres
1490	3	a	The colors and print are absolutely beautiful and i'm quite heartbroken that this suit just doesn't fit. i don't have a long torso but the v was just so plunging that i wouldn't feel comfortable leaving the backyard lounge chair in this bathing suit. no matter how much i tied the halter it still revealed a v halfway down to my naval. the strange thing is that there seemed to be too much fabric on top, lots of ruching and thicker straps than i would normally go for, and while i'm only around a b
1491	5	a	"It has been a long cold winter and spring...but it is going to get hot! and this is a perfect dress for july. i tried this on and did not feel the need for a slip or a cami, yes, it is lightweight, no, i would not consider it for work, but when it gets hot in the summer, i feel like this will be a perfect slip on and go dress for days or casual evenings. i wear a 12, and the medium fit perfectly i considered ordering the small, since i had some extra space, but again, it is going to get hot,"
1492	2	a	This shirt is beautiful. it is flowy and light, a perfect piece for transitioning from winter to spring. however, do not follow the washing instructions on the tag. it says you can machine wash, tumble dry low, and despite going one step further and washing on my gentle cycle in cold water and drying it on extra low, it came out of the wash so small that a child could barely wear it. it went from being a tunic to an inappropriate crop top i will never wear again. if you do order, please take the
1493	4	a	I really love this dress. it runs very true to size and is nice and long, but could be easily hemmed. i am 5'10' and have room for heels. the waist runs just slightly high and causes a slight flare out of the fabric at the hips but it is not a deal breaker. the cotton is super light weight and perfect for summer. some jersey fabric maxi 's can be super hot. i was surprised by the cost for the actual quality of the dress.
1494	5	a	Soft, comfortable, stylish. i eagerly awaited the arrival of this beautiful sweater and was not disappointed. the sizing was accurate for a perfect fit and i love the feminine detailing and shape of the necklne. the ribbons add an extra touch of style to a sweater that is both casual and elegant at the same time. very versatile.
1495	5	a	This is a beautiful blouse. great colors and detailing - i absolutely love the design in the back. will look great with white skinny jeans. it does run a bit on the short side but i have a long torso and it still works. i waffled between the 6 and 8 (am usually an 8 and a full b cup).  in sleeveless tops i really like the arm holes to be snug enough to cover that unattractive part between the underarm and breast, so i was considering the 6 but ultimately decided the 8 did so with a bit more comf
1496	5	a	"Surprisingly versatile and figure flattering without being too clingy and revealing like so many ""bandage"" dresses. the navy color softens the stripes. great piece for travel as it is light and does not wrinkle. i am 5'7"" and 125 lbs. with a smaller chest and curvy hips. the small fits perfectly."
1497	5	a	Such a beautiful pattern on a lovely fabric. soft to the touch and flows beautifully. i love the lacing and even the butterfly sleeves - which i'm usually not a fan or. i have a feeling i'm going to wear this to death once the weather warms up! my only complaint is the slip, which is a scratchy material that is also completely see through. it's also very short, at least for my comfort. i have a plain black slip i'll be using instead, which is fine with me as i bought the dress for the outer shel
1498	5	a	"I am 5'0"", 109lbs, and the 00 petite fit perfectly. the length was great too. as one reader noted, the zipper can be a little tricky  but dont let that deter you from getting a pair of these sweet duds. it stretchs out a little as the day goes by but that is bearable.  it has a hint of pink to it too. can be dressed up for the office or dressed down."
1499	2	a	"I wanted a comfortable and loose casual dress. i liked the pictures and decided to give it a try. the dress turned out to be too loose (i got size 4 after checking the measurements chart, i'm 5'7' 125 lb and usually wear s). i could practically wrap myself in this dress. besides, it looks a bit too long (well, i'm not as tall as the model in the photos and i don't like wearing high heels). the material looks faded, not as bright as in the pictures. i like distressed and vintage style, but this"
1500	5	a	This is a lovely, romantic skirt that hangs nicely. it is lined except for the ruffle on the bottom. as others have said, the waistband is stretchy and molds to your shape. it is high waisted. i called the store to hold a size 4 and 6 for me to try. when i got there, i finally settled on a size 2, so it runs a bit large. i have a 25 inch waist and 36 inch hips. if this fits your style, give it a try, you won't be disappointed.
1501	5	a	Great mock neck fits well and looks great with pants and skirts!! also love the dark grey color!!
1502	1	a	"I love this outfit so much and bought the skirt pictured with the top on the model in high hopes my quest for the perfect date night outfit would be ended. not so. for starters the top is much more of a beige in person. a horrible unflattering color that few can get away with successfully. secondly there is just so. much. fabric. it billows and bunches all over the place to wear it out like that as shown would be silly and to tuck it in looks like i've tried to hard to make it ""work"", lastly the"
1503	5	a	I've been stalking this top online and finally went into the store today to see it.  i'm so glad i did!  the colors are very vibrant and the material is soft and very lightweight.  the cut covers a regular bra pretty well (a big plus!) and makes my arms look good!  i can't wait to wear this, it will be a perfect dressy top for the higher heat days!
1504	3	a	This was going to be my go to top. i loved the look of the billowy shirt, especially in light blue. when it arrived, i knew it wouldn't work for my body. i'm athletic build with muscular upper arms and a d cup. i tried it on anyway. i really wish it fit. it was snug in the upper arms and pulled a bit in the front. i knew if i ordered a size up the arms would still be tight. it's just the cut of the shirt. this top is best for someone that isn't busty and has slender upper arms.
1505	5	a	I love this top. i wear it all the time.  the problem is that you can tell i wear it all the time as the fabric has started to fade.  i'd still recommend it as it is so comfortable.
1506	5	a	"When i saw this sweater, it made me think of the 70's chic trend thats very now but due to the colors (my favorite tones) it would be something i would be reaching for for years to come. i love it combined with jeans but i also worse it over a dress (see photo) - i am wearing it over corey lynn calter floral dress ""paeonia dress"", and i paired it with the ""rosebud layered necklace"". i got two of this sweater as i want to have one for when i wear the first one out :) i am 5'6"", 127 and even thoug"
1507	5	a	I bought this stylish and cozy sweater in ivory. i find that cable knit sweaters tend to add bulk, but this sweater creates a long, lean look. it looks great with leggings and skinny jeans, and the buttons on the cowl are a fun detail. every time i wear this, i get compliments on it.
1508	5	a	This dress is soft and hits all the right spots. the neckline makes it a little alternative which i like.
1509	3	a	I loved the colors on this dress, but i don't like the way it fits. it is tight around the shoulders, but the rest of the dress is really big and has no shape
1510	3	a	I really love this top, but am afraid i may need to return it, because the fabric is so delicate that little snags began to show up within hours of wearing it, and they show really badly as black spots, because the fabric is made with light and dark delicate threads. it feels so good on though! you must be super careful with it. i have no idea how the little snags even got there!
1511	4	a	"I ordered this top in the pink in a medium (i usually wear a small or medium in retailer shirts). it fit tts with not being too short. the embrodiery is very pretty, better in person than online. my only complaint is it's a bit blousey, so you would need to either tuck it in or wear with skinny jeans/shorts. for reference, i am 5"" 4.5""' 135 lbs and a 32c."
1512	5	a	This is such a cute little top that can be easily worn off the shoulder or on the shoulders. it is comfortable, soft and quite flattering. it hangs nicely and is a pretty white top that will come in handy this spring and summer. i stayed tts on this one but could have sized down.
1513	5	a	The length on these are great. they stretch but so far they don't stretch out. the material is a dark and soft. i am 5'6' and 135lbs. the size 26 fit great.
1514	3	a	"I tried this on in the store and the colors and fabric are terrific. it's very light-weight fabric but isn't see-through. the colors are medium in depth, not too bright. if you typically wear ""cool"" colors and avoid browns, you may be able to wear this because the brown is very muted. there's two strings inside that you tie around your waist to pull the bust of the dress in. i'm 5'4"" and 125 lbs, so there's simply too much fabric in the dress. i would have bought a petite. the tag says it's avai"
1515	5	a	This is a great pair of trousers for work but can also be dressed down. they are very flattering and runs true to size. they're also a bit highwaisted which i love. my only complaint is that they are unlined. i'm not sure why a nice pair of wool trousers would be unlined. however i'm still giving them 5 stars because the fit and quality outweigh the one con.
1516	5	a	Love this top. comfy, soft, and a great length. slightly longer in the back, and works great with leggings or jeans. i love that is has long sleeves. i wish it came in more colors.
1517	3	a	I wanted a casual but special summer dress and had high hopes for this one. i normally like to try things on as it is difficult to tell fit online. when it arrived i was disappointed with this dress. it is very full in the skirt, the top fit a bit odd, not a lot of shape and not especially flattering. the fabric wasn't very exciting either.  unfortunately this one went back.
1518	5	a	"I popped into retailer the other day just to look around, and saw this dress - the fabric stood out first, then i saw the cut and style, and fell in love! they only had xs and s, and i'm usually a m because of my chest (34d) but it looked so voluminous, i thought i'd try it on. the s fit perfectly! the bodice fit a bit more closely, and the rest of the dress flowed beautifully beneath it. the sleeves are quite large, but it's kind of a fun look and feel. it's got a very ""peasant princess"" feel to"
1519	4	a	"I agree with a prior reviewer who stated this seems overpriced - it is. it's very lightweight and not quite the quality i would expect for the price (the washing instructions tag was sewn in all crooked - really?). i ordered the black as i was hoping to wear this to a dressy (though not formal) event but i am not sure it works on me. i think it would be a really fun summer dress option in either of the 2 colors (the blue looks really pretty online).  it is very cute but definitely runs large."
1520	5	a	This product is comfortable and stylish. i love the design and the color print. i can dresss it up and dress it down. it goes with everything and also fits great.
1521	1	a	Very unflattering and no shape or flair. lots of extra material but no swing or shape. do not recommend.
1522	5	a	"I ordered a pair online, they came today and i am in love! the fit is great, i love the high rise waist. i will have to hem the bottom, i am a tad short (5'3"") and it is rare that i don't have to hem my jeans. they make my legs look longer and are a very flattering fit. i am very pleased with my purchase."
1523	5	a	This is a review of customer service in general,from several issues with online shopping! i don't understand why you ask for my opinion and say it counts when clearly it does not.i have had a lot of issues. receiving parcels from one of your carriers,laser ship and i have reported the issues to them and retailer,but it appears only the good parts are read.this poor service cost me money in postage and lost discounts but again i'm ignored,and i had to order my last returned parcel again pay more fo
