0	5	a	"Stunning, beautiful, elegant, comfortable and all silk!  the print is very mesmerizing, as are all the hemant & nandita pieces i own.  i'm shocked that there aren't more reviews.  i found this fit perfectly on my body, skimming over my flaws and keeping my temperature moderate.  i am 5'3"" 140# 39-28-35 and purchased size mp.  please retailer, offer the other versions of this dress as shown on the uk retailer site."
1	4	a	Medium is equivalent to eu size 40. the pants have the eu tag and i would have ordered differently if i had known this. great quality pant; just order according to your european equivalent.
2	5	a	I love this tank! basic but super sexy! i'm an a cub and this tee makes them look a lil bigger so i'll take it!! i bought the dark grey in small and went back for the striped grey and purchased small. i bought the black one too but i feel like the small in black is too big and the xsmall is too small. i'm torn because i want the black to tuck in a pencil skirt.
3	5	a	I am writing a review even though this is currently sold out (and was just released). what i love: the fit: snug, not too tight, and xs is true to size in the sense of historically. the wasit is cinched in, ample room in the chest. the fabric is substantial (thick and sturdy) and not prone to wrinkle, based on me having it in the bag in the hot car) and no false pleats was created. the sleeves are fun and different, may be a bit much for some. it is in multiple pieces, why it flutters so nicely.
4	3	a	Disappointed in the quality of the dress. love the style and especially the colors. the fabric of the body of the dress is very very thin and just poorly made. the top bodice is more substantial. not worth the price tag of $148.00. dress does run short.
5	5	a	I love the design of these. the laser cut outs are solid and hold up in the wash. they are great for work-outs and cute enough to wear as leggings out. i wore them to my bar method class, came home and just changed my top and continued wearing them the rest of the day as a cute outfit. they have a great snug fit and the fabric is thick and durable.
6	2	a	I loved this dress before putting it on, but it was just not the right cut or style for my body type. it is very roomy and full and looked like a maternity dress which was not a look i was going for. sadly this will be going back. i loved the print and the feel of the material. just not a flattering cut for me.
7	5	a	I ordered in this in the kelly green and loved it so much i wore it the very next day after it came in the mail. the green color is gorgeous and easily complements so many other colors in my wardrobe. the cardigan itself is super comfy and i love the full length long-sleeves! so many cardigans these days come with 3/4 length sleeves, which are fine, but sometimes you want a long sleeve. the fit almost runs on the larger side, but i think that a slightly looser look works well for this cardigan,
8	2	a	I ordered a size 12 and it was huge on me! very loose fitting dress. i didn't like the material either.
9	5	a	So cute, warm and fashionable. i ordered a size down and it fit like i was in a sausage casing. gave that size to my daughter and i will order my usual size. the arms are small and the rest is true to size. love the quality softness and style of this. with a hood, for the win!
10	5	a	Love the print and loose fit. doesn't look to wide on my top heavy torso and the sleeves don't cling to my chubby upper arms or tummy. wore all day today, first with shorts then with cropped jeans.
11	5	a	This skirt is really beautiful and well made. the color is a cream/off white like other reviewers mentioned. it fits mostly true to size--i have a straight build with a wider stomach and no hips and my usual 4 fit a tad tight in the waist but perfect in the hips. i just love this skirt.
12	3	a	"I was obsessed with this dress from the moment i saw it online and was so excited to buy it for my company christmas party. i'm 5'4"", 36c, 145lbs and i ordered a 6. the size was great but the whole cut of the dress was completely off for me. i have a fairly short torso but the top portion of the dress (which is a sweater-like material) hit me far too low on my waist to be flattering; the petite may have fixed it, but then the skirt would've been too short. the pleats were cute but flared out too"
13	5	a	In love with this. as soon as i received it in the mail i ordered another color. super soft and easy to wear. i imagine i will live in this top the rest of the summer. felt pricey, but worth it for as much wear as i will get out of it. i am 5'10, 160 and the large is a great fit. perfect fit on the shoulders and just a hair loose throughout the rest of the tank, which is what i wanted.
14	5	a	I ordered this in black and in the print and i am super happy with both. the fabric is very soft. i've worn it with denim and khaki shorts as well as with a cute skirt for work. very versatile.
15	5	a	Get creative with the neckline or let it fall where ever. this is a purposefully slouchy, uber casual, super soft
16	5	a	Since there isn't one where i live, i ran into retailer while waiting for my daughter to pick me up. saw this and bought it off the rack w/out trying on. had to get a m as they were out of s, and yes, it's a tad large on me, but still glad i got it. i think it will be a nice transition piece into fall in hot texas. love how the linen drapes and it makes me feel a bit more dressed up than a cotton tee. the ruching on the sleeves is an extra nice touch.
17	4	a	This is the softest shirt, super comfy, very baggy but i'd say true to size for the style. it is a bit thin and i'm worried how it will hold up, or would have given the full 5 stars. i'm not a usual fan of the turtle neck but this is so soft, i love it!
18	3	a	The small is huge on me and the sweater is very itchy. cute idea but not for me. i will return it.
19	4	a	This top is cute, my kind of style, but it is really sheer. i would need to wear a white tank top underneath.
20	5	a	Love this sweater! it can be used for both work and casual wear with ease. very soft and seems durable. i highly recommend it!
21	4	a	I purchased the teal suit and it was so beautiful! it's super comfortable and has nice coverage. i decided to return it because, as a nursing mom i've decided to wait until i've weaned the baby so i can make sure the fit is still good. but otherwise i would have kept it!
22	4	a	Love the color, weight and styling on this sweater. it is soft and comfortable and i will wear it a lot. the only downfall is that it sheds, so it can not be worn with leggings or you will end up with fuzz everywhere.
23	1	a	Retailer consistently provides unique, sophisticated and quality made clothing. with the exception of an occasional purchase at their sister companies, i shop with them exclusively. i suppose that i can't expect 100% perfection from retailer-but 99% of the time-that's what i get. this is that 1%...this sweater is truly awful! i cannot (or find it very difficult at least) begin to describe what this sweater is like but it is so unlike retailer that, had it not been for the distinct pattern on the front
24	3	a	Ordered med petite. love the print & design but it runs really big more like a large and length of top is not flattering . returning
25	5	a	What a wonderful find! yes, it runs big. .. and beautiful! love the quality, and design. very light and airy. this is great for me because i'm not short & i am busty & i love tunics. this item can be dressed up or played down with class. the lining is a perfect complement to the tunic as well and fits nice with the garment. i am usually to busy to write a review, but i felt obligated on this item. five stars!
26	5	a	Love these! they are my new favorite weekend pant. they are comfortable, versatile, and cute. the fit and cut are great too. a must have for your wardrobe.
27	5	a	These leggings are amazing. by far one of the most comfortable pairs that i own! i should have ordered more. i got a m/l and they fit perfect. the detailing is awesome, and they even stay opaque when you sit, so you don't have to worry about them being see-through. great buy!
28	5	a	"So there weren't any product reviews to go by when i ordered the last small. i had no way of knowing if it ran big, small, or tts. i'm usually a med, but to my surprise the small worked due to the fluid pleating. it sits right on my natural waistline similar to the model and not too short in length (i'm 5'8""). i also like the med weight of the fabric it moves freely when you walk, but not too light. it is similar to a double weight georgette or crepe."
29	5	a	Great fit, very soft fabric, and the sleeves are long enough!! great length in the body too.
30	5	a	I am amazed this is still on sale. it's so comfortable and fabulous!!
31	5	a	I had never worn pilcro jeans, and i took a chance and ordered without trying them on. i couldn't be more pleased! i wear a 26, but it is often difficult to find a good fitting pair of jeans. these fit comfortably and don't feel too tight, but are fitted enough to look great. i like the little bit of extra room around the top, allowing the jeans to feel comfortable. i'll be back for more pilcro jeans!
32	3	a	I stalked this blouse and when the price dropped, i pounced on the black. sadly, it did nothing for me. i'm a large, sometimes medium, but decided on the large. you'd think it came with its own cami at this price, but no. completely sheer. unwearable without one. the lace is nothing special. the collar is wider in the back, uncomfortable and pulls on the lace in the front. the high/low hem fit me oddly in the back. i'm returning this one.
33	5	a	"Stylist at my local retailer recommended i try on this top. as soon as i put it on, i was amazed at how pretty it is. i'm 5'3"" and curvy size medium and the fit is true to size. i would say if you are between sizes, you may want to size down. i didn't have any issues with the lace and the slight v-neck falls perfectly on me. no need to wear any cami.  my only concern was how wrinkled the top was. i requested to have the blouse steamed before i left the store so that i could see if all of the wrin"
34	5	a	I'm so glad i bought this. the picture doesn't do it justice. it's lightweight, flowy and super comfy. i'll be wearing this all the time. very lightweight so it doesn't get hot. love the material, it's soft, light and flattering! color says light grey but it does have a bit of a blue/lavender hue to it as another reviewer said. i love cloth & stone and this is one of my favorites! well worth the money!
35	5	a	"This dress set my heart a-flutter, but i had quite a time figuring out the sizing. i literally ordered six different sizes, and when i put them on, they all seemed to look like a very beautifully embroidered and elegant tent. if only i could just nip it in a tiny bit at the waist! then it would look like the model does! (i actually think they probably pinned the back of the dress to get it to fit on the model).  so i played around with it and ended up putting in 2 small darts in the front. and v"
36	5	a	"I stumbled upon this by accident and i thought the turquoise color looks unique so i tried it on, and it was a great fit first time around. i dislike open shoulder blouses because most of them are too open but this one is very sutble which gives it a girl next door sexy look. the material is very soft, the pattern is subtle plaid, and the liner is a plus. size 2 regular fits me very comfortably (i'm 5'2"", 34b, 26 waist, 36 hips). i could size down more but i like the relaxed look like on the mod"
37	4	a	Cute tank, runs big. i purchased the mango and it's a bit sheer.
38	5	a	I was pleasantly surprised with this cardigan! i get so many compliments- i can easily see me carrying this into my fall wardrobe!
39	5	a	"Let me preface this by saying, im totally keeping this dress!  it is kind of a weird design, but intriguing. i received it in the mail yesterday, i am 5'6"", 125 lbs and have hips. as a previous reviewer mentioned, this dress is more fitted than a swing dress as it appears. fortunately the xs fit me just right - but i cannot gain another lb.  my husband said that i looked like i was in a choir because of the higher neck design and bell sleeves, but he too found the dress somewhat alluring."
40	5	a	Love this dress! purchased it online, the xl sizes can be difficult to find in the store. dress is very cute on and you don't need to be reed thin like the model. it flatters the figure and yes, i wore spank with it. the length is good, the design (black and neutral) is flattering. i chose this to wear to my husband's christmas office party (his new job)! you know first impressions; i did not want to be over dressed. i wore my antho black boots which lace in back and go over the knee- (slouch a
41	3	a	I am somewhere between a 24 and a 25 (i have narrow hips but an average waist), so i was happy to find that these worked for me in me in a 0. i loved the blue color as an interesting neutral. they did stretch out a little with wear, but i still felt like i looked good by the end of the day. i typically really like cotton/linen blends as i can usually wear them out of the dryer if i'm going for a casual look - a few wrinkles with linen doesn't bother me. but these. oh my. when i pulled them out o
42	5	a	This sweater looks great with chambray colored denim. i wear it with jeans, shift dresses and even leggings. definitely one of my go to sweaters for the fall.
43	5	a	"These fit beautifully and are very flattering. they are true to size but may be a little long. i am 5'5"" and wear these with 2 in. heels. i have already had numerous compliments on them."
44	5	a	Surprisingly flattering and so very soft and comfortable. have had many compliments on this. super cute paired with skinny jeans and boots. also purchased the ausaria infinity scarf in navy which contrasts nicely with this top. and a plus--no signs of pilling yet.
45	5	a	Beautiful skirt, love the colors. so glad i bought this. runs a little big
46	5	a	This white blouse is absolutely stunning in person. i wore it with a nude strapless bra. note to self: remove makeup before blouse, otherwise it's all over your blouse.
47	1	a	This blazer looks great on the model and i have a long torso so i thought it would be perfect. when i got it it looked like a big box and didn't fit anywhere. the shoulder pads were giant and the bottom of the coat was huge. i got a small based on other reviews, but it was way too big. sadly, i had to return it.
48	3	a	I really wanted to love this dress, but it just wasn't flattering on me. i have curves and i was hoping this would hug them in a joan on mad men way (sometimes these dresses that just hang on super thin models can look beautiful in a different way on a more voluptuous woman) but it was pretty shapeless on me. it also dips so low in the back that i would have to get a special bra to wear it. might be right for a more slender shape or someone who can go braless, but it didn't work for this short,
49	5	a	I ordered the orange color online and was very happy with the product when it arrived. it's a soft orange color, perfect for fall. the shirt is thin and probably will need a cami underneath, but it's longer in the back than the front and will go great with leggings or skinny jeans.
50	5	a	"I've been on the hunt for flattering cords for a long time, and these fit the bill! bought the silver on friday and am going to order the pink. the silver is really more taupe, as pictured, so if you're looking for true grey, this is not the pair for you. but the fit is fantastic. i'm 5'3"" athletic build about 130 lbs and the 27 fits perfectly. finally cords that don't make my muscular thighs look giant!"
51	5	a	This jacket is extremely good quality, has gorgeous detailing and is warm! quilting makes it thicker than expected, but plan to wear as both a blazer and fall jacket. highly recommend.
52	5	a	A great basic t, so very much cuter than most. i have black and white both and wish it came in more colors.
53	1	a	Looked really cute on line. arrived with a large hole in the front! quality and look was very cheap!!! would not recommend this sweater at all. step it up please retailer!
54	4	a	"I love this dress in the fact that it isn't low cut, isn't several inches above the knee - and bam it has sleeves! the length is gracious and the all over print flattering for a full figure. the skirt has a wonderful swing to it. i'm 5'4"" and 165, so i ordered the 12 regular. it does fit (and has stretch to the fabric), however it is too long in the torso on me. so much so that the low waist seam pops up and the zipper bumps out when i move around. i pulled up the top by an inch or two and the d"
55	5	a	I got this dress in the gray, size small and it fits me perfectly. it hides flaws in your figure and is nice enough that it can be worn to the office and then out later for a date or dinner. i did not try on the white/black combo because i thought the white top part might be too sheer. unlike other reviewers, i think the contrast of fabrics works. i'm not sure why there are negative reviews here, i must have the right body type for it because i love it!
56	5	a	Bought one for myself and one for my mom.  we both love it.  super soft. boxy and oversized but great for layering over a belted tunic.
57	5	a	This cardigan is very similar to the c keer wrapped asters cardigan from a few years ago....i have this cardigan and have loved wearing it; i think it only came in cream color. unfortunately, i caught the cutouts a few times, and the cutouts are slightly ripped in 2 spots...not very noticeable, but i know they're there! so i was delighted to see that retailer brought back this cardigan, this time from meadow rue. i purchased both the cream and gray colors in a size small....i am usually a s
58	4	a	I thought the design was adorable. i ordered up bc of reviews and i am glad i did. i am a size 6 so i ordered a size 8. the upsize is needed so u can get into the top part of the romper. otherwise it would be mission impossible. it's a pain to get on and off as all rompers are but it's soo cute it's worth it. had compliments on it the first day i wore it.
59	4	a	Cute dress that is perfect for a casual summer wedding or brunch with friends. i love the material and that the dress is lined. it is very comfortable and it has pockets. this is definitely more of a ?golden? yellow vs. a soft yellow. my only complaint is that i wish it were cinched more right below the bust. it would give the dress (and me) more shape. i would say this dress is true to size but if you have a larger chest, you will likely want to size up. if you have a small chest, i would proba
60	4	a	I love this designer and decided to give this one a try. i ordered size large in black. it's a nice weight knit but not too heavy. good for fall and winter. the color is an intense,  saturated black that's really sharp looking. i thought it split up both sides, however, it's only split on one side and then angles across the back to the other side, which isn't split and is shorter.  i carry weight in my midsection, and this flows a bit away from the body but not in a giant oversized way. i like t
61	4	a	I am 5&#39;4, 125-130lbs, c34 bust. i ordered this dress for a wedding in size 2 and it was too big! exchanged for the size 0 and it fits perfectly. order 1 size down, ladies!
62	4	a	I really like this romper and i ordered it to fit my bottom. i'm a 6 on the bottom and 4 up top. i ordered a mp to cover the bottom and a petite for my height. it's a keeper but i will be belting or adding something to cinch it at the waist so that it has more of a shape.
63	3	a	I thought this top was absolutely beautiful! i couldn't wait to get it in but unfortunately it was very big on me. (i'm 5 ft, 105 lbs and got the pxs) the arm holes were so big as well as the overall fit. i'm very disappointed, i really wanted this top to work.
64	4	a	Beautiful sweater, very delicate fabric, unique design, but it runs very small. i usually wear a m, but ordered a large based on the previous review hoping that would do the trick. the sizing, along with being long waisted isn't a good combination. unfortunately, i'm returning the sweater.
65	5	a	I could seriously sleep in this--it's that soft! i dressed this with a white tee and holey jeans then i wore it to work today over a blue midi dress. love this jacket!!!
66	5	a	"This is a gorgeous dress that while it runs quite small ( i normally take a s or xs ). i had to exchange it for a medium. i am 5 4"" and it falls below the knee which is how i like my dresses. it is a gorgeous pattern of color which could be worn for 3 seasons. i look forward to wearing it for many special occasions."
67	5	a	The fit, the length, the color, the fabric... cannot say anything negative at all! the sales associates at the store where i tried them on said they had just gotten them in, and she could not wait to see how they looked on. they were just as awed as i was! the pants can easily be dressed up or down.. the brown color is so, so, beautiful! i would expect these to be twice the price for such a high quality pant.  i consider it a timeless cut and can worn for seasons to come.
68	5	a	"Nice dark indigo with minimal fading. medium denim thickness, with stretch. i bought size 25 and it is snug, but doesn't squeeze. my hip is 34.5"" and 28"" waist. love these. i will be getting them hemmed up to ankle length. i am 5' 5"" and find the little kick out at the ankle (from getting them shortened) to be very cute and classy. if you keep them full length to your shoe, they will have a slightly baggier bootcut look. these remind me of my point sur hightower straight leg jeans, with maybe an"
69	4	a	This is a nice top but it runs very large. the small was still too large for me. hoping they have this in xs.
70	1	a	Very poorly made- wide and short, very unflattering. the material is advertised as cotton, but it felt very synthetic.
71	5	a	I tried this top on in the store and didn't buy it because i was in a hurry. obsessed about it and it was sold out when i went back. so happy i was able to get it online, it's beautiful. i got a medium and it fits perfectly, enough room that it hangs nicely but not baggy, i'm typically a medium in shirts at retailer. it looks beautiful with high waisted black pants. i wear a cami underneath. i own it in white and tried it on with a black bra only and it looked great, i just didn't feel comfortable
72	5	a	"This coat is spectacular. it was love at first sight but it was only after trying it on in a store that i decided i really wanted it, even at the full price. the design is unique and gorgeous, you don't see coats like this on the street, not a cookie-cutter. it's very soft, yet warm, and has a gorgeous ochre colored lining making it very easy to put on and a standout when a bit of the lining is revealed. it seems the fit is what most reviewers complain about and i can see that. i tried size 2 ("
73	5	a	This sweater caught my eye while in the store shopping for a gift. i am on the shorter size so i was worried that it would drown me. it didn't! it hits me mid thigh. the sides are cut up high. i will wear a cami or shirt under it. super soft material. flattering fit. i have put on a little weight and this hides all the problem areas without looking frumpy. thanks
74	3	a	So this is still a pretty cute shirt, but my xs is missing the ruffle in the front and has layers on the bottom front of shirt. it doesn't seem to be defective, just a different version of the shirt. i'm curious to find out from others if they have gotten the same shirt as i have. still deciding whether to keep or not. no more left in xs to place another order and see what's up. i do wish it had the ruffle in front, as that is what caught my eye.
75	5	a	"Button down shirts usually aren't my thing, but the soft fabric of this top makes it feminine and comfortable while still keeping that classic look. it's also easy to dress up or down, which is great! i am 5'4"" and small-framed, and the size 0 fits just right."
76	5	a	Tried this soft yummy jumpsuit on and loved the flow and softness of the fabric ...... will be able to wear into the fall with oversized sweater or wrap. just love
77	3	a	The color and fabric of this item are so appealing and i think this is a great piece for the right person. the fabric is beautiful but also much thicker than i'd imagined from the photos. it has a quilted quality so doesn't drape very well and is just too much fabric for me around the arms. i typically wear a size 12 and ordered the large. i think a medium might have been better. haven't decided yet whether to exchange for m or just plain return. has an artsy, cool professor vibe that i like.
78	5	a	I could live in these. they are so comfy. i typically wear a 6 and got the medium. they are a little roomy. probably could have gotten a small..but i like them kinda loose and baggy. i will probably purchase another color!
79	5	a	Great jacket for a cool morning. not too heavy and i found it to run true to size. nice little details.
80	4	a	I knew from previous pilcro purchases to size down. went down 2 sizes and they fit perfect. this dark wash doesn't have as much stretch as some do which i prefer because they stay up all day.
81	3	a	So this is a great tee, problem is the white you can see through. i an not looking for a layering tee so not what i was looking for.
82	4	a	Pic doesn't do it justice, very flattering. i got it in navy. definitely worth the sale price!
83	4	a	Nice, flowy dress... only thing is that it has the high low skirt which i think is getting outdated. beyond that, it is a cute dress.
