2246	5	a	It is rare that i find a pair of pants that works for me at retailer. as a woman with curves i have found that most of retailer's pants are cut for slim figured women, this rare pair of pants crosses the divide, flattering both shapes. i usually have to look for xls. here, i found that i had too much room and sized down to a l. these pants are great. they are lightweight without being so gauzy that they highlight imperfections. they will be my go to summer pant. i love them.
2247	3	a	I really wanted to love this. i kept refreshing the page so that i could order it as soon as my size was in stock. i love the colors and struggle to find cute dresses in natural fabrics for the summer. unfortunately as another reviewer mentioned the cut of the arm holes is strange. it cut my off in the most unflattering spot.
2248	5	a	These are great jeans and worth every penny. they hug every curve and have just enough give in the places that you need them. i find them to be very figure-flattering and dressed them up with high heeled boots and a nice blouse. even though i'm petite, i ordered a regular in my size (26) because i wanted the length of regular jeans as opposed to ankle length.
2249	5	a	Great jeans!!! i'm over 60 & it's difficult finding jeans. these fit like a glove, with just enough stretch & the twisted hem adds a bit of unexpected style. i liked them so much, i ordered another pair!
2250	4	a	"This top is so soft and luxuriously comfy! i love wearing it around the house, haven't really ""dressed"" it up yet with jeans or jewelry. it runs slightly big, but if you like the oversized look, this is definitely perfect."
2251	4	a	"Runs really large. i am 5'4"", 120lbs, 32c, and had to exchange xs for xxs for width, but then the sleeves were a little tight. decided to keep the xxs in white."
2252	5	a	I eyed this for so long hoping it would go on sale. i finally bought it during the 20% off retailer members day. sized up from my usual size 4 to avoid the buttons on the bust looking like they were about to burst free. the rest still fits way. i absolutely cannot wait for the next rainy day to wear this!
2253	5	a	"I'm 5 ' 5"" and 132 lbs., 34d and the size m is perfect. i will probably wear a thin, long cami under it as it is slightly see through. it doesn't gape under the arms like some sleeveless items...it fits smoothly. as the other review mentioned, it would be a perfect swim suit cover up. but i'm going to wear it more as a casual, very versatile, perfect for a hot day summer dress!"
2254	5	a	Just picked this up at my retailer and i just love it. its totally different than your typical tee. the bottom is more of a blousy silk material and the top is a super soft knit. it lays really well and is long enough to wear with leggings! my favorite part is the t strap in the back. such a beautiful detail and so much fun. my only criticism with this top is where it hits on the bust. im a little more full figured, so the top looks better on me when the silk part isn't under my boobs. kinda have
2255	5	a	Love this dress. sooo comfortable and flattering. i typically wear a 4-6 in dresses or can be between small and medium depending on style and cut. i went with xs on this dress and it's still very comfortable and loose fitting. the small size fit fine but seemed like too much fabric on the skirt.
2256	5	a	I just love the print on this shirt!  it is so feminine and pretty!  the material is very soft!  i took my usual medium.  a great addition to my spring wardrobe!
2257	2	a	"I bought this dress in an xs, and am 5'4"", 115 lbs, and fairly proportional. the shoulders were snug, but the hips (and maybe waist)were at least 2-3x too big. comically so-- the fabric stood away from my body like wings on each side."
2258	4	a	This has a very nice hang to it- combination of the cut and linen- like fabric. i liked it so much that i bought two different colors. so many tees are blousy and full now;i am short so they look like maternity tops. this one is much more flattering.
2259	5	a	Okay, i am not that tall and don't have legs for miles, but i loving wearing a wide-legged cropped pant with heels for a change from the everyday. these pants are great because they are 99% cotton. the cotton is a nice weight (not too light) and the barely there fringe bottom is a nice detail. i usually wear a 28 in pilcro and that's what i bought! i would describe the color as leaning more toward khaki than green, though it did look little green under the lights in the store.
2260	5	a	Velvet always has made quality clothing and i had purchased the same shirt in another color and i wanted to see if they had other colors, they did and i got 2 more. i received in expected time and they were wrapped nicely. thank you for great choices of unique clothing.
2261	5	a	I wanted this top so bad i ordered one size up (only size left in navy) and it is a little big but i still love it. so fun, love the color.
2262	5	a	These pants are fabulous. the flow and feel made my mind up easily to purchase these. i have a long torso and short muscular legs. the style complimented by body type. being culottes, the hem should probably fall higher up on my legs. i will probably have them hemmed. the pleat has a nice kick to it. now off to find the right pair of shoes...
2263	5	a	I loved this top. i paired it with he ag stevie short and jasper and jeera beaded sandals. look was super cute and casual. i love the fact you can adjust the fit in the back with the lace up detailing. flowly tank without the maternity look. i went with the lavender color and it looks great with my olive skin. i had no problem with sheerness when wearing a nude bra. for reference i am 5'6'' 132 lbs and went with the small.
2264	5	a	"I tried on this dress in the portland, me, store today. so much good to say about it: the wine color is deep and rich, the fabric hand is similar to a heavy weight silk, the cut of the dress so flattering. but, i didn't get it. i am 5'2"" and weigh 135 lbs. i can sometimes wear a medium, but my upper arms and hips can require a large, usually petite for proper length. the store didn't have a large (i didn't even realize the dress also came in petite), so i tried on a medium. nice fit through the"
2265	3	a	"Tried this on in the ""onsie"" area of retailer store. i usually am between a medium and a large. the medium fit fine. the material in this top is substantial - very thick and soft but it is very thick as a warning. more for a pretty cool spring evening vs the heat of the summer in chicago. not sure how much the material would stretch out either. as it seems like it could be the type. also, it is dry clean only, and on such a casual top, that is a real deal killer for me.   regarding the style of"
2266	5	a	Love these jeans, comfortable fit and material is soft.. fit true to size and have a good rise.
2267	4	a	This shirt is nice and flowy. it can be dressed up or down. very lightweight for summer, but the color will work for early fall too.
2268	5	a	I bought the orange color and the pattern is absolutely beautiful. the fabric and style is very flattering and comfortable. well worth it. runs true to size (i am usually an xsmall 134 lbs 34 c and the xsmall fit perfect). perfect summer dress: soft fabric and light.
2269	5	a	I got size 26 and they don't fit me as ankle, they fit me as long skinnies, but the quality is so good. they're smooth and stretchy, but they feel thick enough that when you pull them on you can tell it's quality denim. a great pant buy if you're looking for soft as butter grey jeans.
2270	2	a	"I ordered the white and the light blue in size xl. both are cut much smaller than is typical for my other retailer xl blouses. everything the first reviewer wrote is true. the photos of the white top show a detailed back when it is plain (like the blue). the back is just a solid, kind of slippery material. it's strange because it's not see-through in the back but you need to wear a tank/cami for the front. so, it makes the shirt that much tighter since you need to have the extra layer.   i would"
2271	4	a	"I am not going to keep this dress, just because i am a little too old and need a little more structure for my figure. but it is a very cute, comfy throw-on dress. you could wear tennis, bootles, etc.  especially great for a pretty slender person,..then the loose flowy style is still attractive"
2272	5	a	"-like others, i agree that this is a staple that will pair with many, many outfits. it is really well-constructed, classic, comfortable, and a wonderful length for us taller gals. as you can see from my stats, i'm rather tall at 5'9"", so it's hard to find"
2273	3	a	"Love the cut and the way they drape. size 26 and 5'6"" 135lbs fit great until you wear them for an hour. all of a sudden my 26s became 28s. they were practically falling off. i plan to wash them to see if they shrink. i wish they held their shape since they are so cute."
2274	5	a	"Absolutely gorgeous! words can't describe the beauty of this dress! i hope they will restock it cause i would order size s (didn't know how it runs)."
2275	5	a	This top also caught my eye in my local store, and being a devoted deletta lover, i had to buy. it is a straight, slim fit, so i bought a medium, instead of my usual small, to glide over my curvy lower half. it's thin, finely woven knit, with two cute little buttons at the top of the side slit; the cut and longer length in the back is very flattering. i bought the heathered black and have worn with my black pilcro leggings; it's a great top to wear over leggings or skinny jeans; no belts with th
2276	5	a	I ordered this cutie before i read any reviews and i am so glad i did. mine does not have any weird smell at all. i ordered a medium and i wear a size 8. it fits perfectly and is long enough to wear with leggings ...with coverage. the detailing on the yoke is so pretty. i bought it with a discount promotion so it made the price better. i am really glad to add it to my wardrobe!!
2277	4	a	I wish there were 100 colors, i'd buy them all. the white is super sheer, but i'll use it as a bottom layer for something.
2278	3	a	This runs small, i got the size 3 which fits like a medium, not a large. its a bit of an aline shaped knit in a beautiful saturated navy. i loved the elbow length sleeves. i have a large 34g bust and although this fit, it came to the top of my waist and i'm short-waisted. it's a great basic for someone less busty or who likes a shorter length.
2279	1	a	I have purchased a lot from retailer but lately, some of the items have been disappointing in quality.verses cost, this being one. the picture is nice but the actual blouse is nothing like this. the size was not accurate so buy a size bigger because of the sleeves.
2280	5	a	Love this top! runs true to size. exactly as pictured.
2281	1	a	I have never had a purchase go wrong at retailer, which is why i am was not hesitant to spend this much money on the blazer. however, the quality is very poor - it feels like it might fall apart after one clean. also, the buttons where not sewn on properly. i wear an xs and the size was a good fit, but the overall quality was not worth the price (or even close to it).
2282	5	a	These are super comfy and so flattering. i feel like the picture doesn't do them any justice! they would also look cute paired with wedges!
2283	5	a	This dress will be perfect for the mid-september wedding i'm attending. september is a transitional month fashion-wise and this knit dress will be perfect. the shimmer (which isn't apparent from the website) makes it festive enough for a wedding.
2284	5	a	These leggings are so thick and soft! they feel like velvet on your skin. i am so, so happy with my purchase, and would recommend these to anyone who is looking for a unique, comfortable, and quality pair of leggings.
2285	5	a	I was worried this sweater would be too tight, but it has a very flattering fit. i am a librarian and this sweater makes me feel like a quirky librarian. i love it!
2286	5	a	"The other reviewers have already adequately praised this very attractive sweater, but i'd like to add that the sizing is large. i fit perfectly into a regular small, although regular medium is my usual size. i am 5/1"", 130#, 34f, size 8 top. the medium swamped me. the shoulders and sleeves were comical, and the body too big. i imagine many of you are scoping out this lovely, comfy piece; you'll want to hit the right size the first time. my store didn't get the coral, so i can't speak for that, b"
2287	5	a	"So i recommend wearing with something more fitted, or with a flare (jeans), or tucked in like the picture. i love the detail of hte polka dot on the sleeves and collar (inside), so if you leave the collar open or roll the sleeves up a bit, you see hte contrast. it is a bit short, and i am petite, i ended up with regular size anyway otherwise, it may have been too short.  colors are nice, and i love the material, it is very soft and hoepfulyl warm (my orffice is freezing). should ahve grabbed it"
2288	4	a	I tried this on when i saw it hanging in the dressing room. i was pleasantly surprised by this piece. the color is beautiful - not too yellow - not too brown. i have not worn it yet so i'm assuming it will hold up pretty well considering my other pieces from this designer are still looking good with several wears. i bought this in a small size so it does not hang down like it does on the model. perhaps that's why i don't need a cami underneath.
2289	5	a	"Classic retailer piece that i am so happy to have in my wardrobe. high quality all wool felt jacket. unlined, stretchy comfortable knit. i wear mine as a knit blazer and love it. it is not merino soft, but soft enough to wear over a long sleeve tee. the neck does not itch.   fits tts, i wear a l and that is my normal retailer size. i am tempted to get the cream as well!"
2290	5	a	These leggings are very comfortable with a bit of control. i ordered the m and they fit perfectly, as usual i do have to tuck the hem up just a bit but i have to do that with all my leggings. i love the laser cut detail on the side which is a lavender color.
2291	5	a	I was looking for long vest to go with skinny jeans. this is exactly what i was looking for. the color is better than the pic to me. the style is flattering.. the size is just right. can't wait to wear it. i strongly recommend it.
2292	5	a	"I purchased these bottoms with the matching peplum top in romantic floral. i also purchased the higher waisted bottoms just in case.  i returned the higher bottoms and that's saying a lot.  i have two sons and now struggle with fit in regard to two piece bathing suits.  the higher bottoms just didn't fit right and i didn't need the extra coverage because these fit so well and the peplum gives extra coverage, though not really necessary.  the others cut in a bit in the seat and hips and these"
2293	5	a	"I love the fit and the color. i would buy this t-shirt again in other patterns and colors. the fabric is thin and lightweight, but i knew that when i bought it. ( apparently, nothing this is a problem for some others.) i do choose to wear a camisole or a tank top underneath it. to preserve the fabric, i hang dry after laundering. the colors have not faded, and the fabric is holding up well. i am 5'4"", weigh 134 lbs, and do typically wear size medium."
2294	4	a	When i saw this top.... i had to have it.....runs very small... would size up especially if curvy on top.......sheer but not too sheer...... feels and looks delicate...... no problems so far
2295	5	a	They are very comfortable and have kept their shape after a couple of wearings. the pants can be used for informal or on the dressier side. the spandex in them is contributes to the comfort.
2296	4	a	Gorgeous laser cut top layer in a true vermillion red, oh la la! style is feminine, elegant, and appropriate for all ages.  i plan on wearing this for the upcoming holiday season as well as valentine's day 2017!  quality is top notch and fit is true to size all be it a little snug in the sleeves.  for reference i'm 34e-30-40 and the size 8 worked, i would have like to have tried the 10 but the store only had an 8.  the arms are a little snug, nothing uncomfortable, just snug. length is below kne
2297	4	a	I loved the fabric and this print but it was just cut a little wrong for me. the gathering on the side made me look a bit wide. but the fabric is beautiful and everything else was nice. i did like the fact that it ties in the back so you can slim down the sillouhette (sp?) if you want to.
2298	4	a	This dress' style and color is very flattering. i think i will wear it in the spring and fall as well as the winter.the m fits me and i'm 5'8' and 140 pounds.
2299	1	a	I am 5'2 107lb and an xs petite.the embroidery was the only nice thing about this dress, but everything else was really unflattering -- the huge puffy sleeves especially. another reviewer said this was more like a shift, and she was right. not worth the price on sale.
2300	3	a	"This is as pretty in person as it is online, good quality (except one item i'll get to), and fits true to size. i'm 5'6"", normally a medium/8, and the medium fit great in this top. i almost kept this shirt...so close, i had it on a hanger, but i kept trying it on. the shirt is well displayed in the pics online, but unless you get close it's hard to see that the top button is set a little wide. every time i put it on, my eyes went to the top button (i did get a second opinion and they agreed)..."
2301	4	a	"The wide strap style is very flattering. this tank is fitted in my normal size small, it fits like the model in the cobalt blue color. i'm 5'7"" 120lbs. if you want more room, i'd size up. it is low cut, but not inappropriately so. fits like the picture shows."
2302	4	a	"Love the design of these pants and they are super comfortable. perfect for running errands but managing not to look like you just rolled out of bed. bought the regular m size (usually i want petite because i'm 5'1"") and while they are a little long they still fit relatively well"
2303	2	a	"I loved this top but the cut was too short in the waist for my 5'8"" frame. wish it came in a tall size!"
2304	5	a	I love this brand and their different styles of tshirts. extremely soft, washes well and wears well! the shirt runs a bit large and i usually wear a medium, but in this brand i am a extra small or small.
2305	5	a	"This 1960s aprs-ski style sweater is made of an amazingly soft pure wool in a color that is a touch brighter and maybe even a bit more coral pink than the online photo looks to me. there is a large button under the collar that shows if you stand it up. seems to be of a very high quality, comparable to vintage hand-knit sweaters. . it is very chunky and warm, and i would recommend taking a size up for a looser fit. i'm 5'2"", 33-25-37, narrow shoulders, and otth the xs and s fit me well, running"
2306	5	a	I love how pretty and soft this shirt is. it falls well. i want to wear it everyday.
2307	5	a	"This is my first romper and i am in love.  so comfortable and easily dressed up or down.  i am usually an xs, small, or petite small in retailer brands.  the xs worked best for me.  the petite small was too big.  i am 5'2"" and the length of the xs is perfect ankle length.  i was nervous to put it in the washer on delicate cycle but it came out perfectly."
2308	4	a	I saw this in the store and had to try it on. luckily i grabbed a couple sizes before heading to the dressing room since i thought it looked large but wanted to get the best look. i normally wear a large in most retailer items and if you want a really roomy look you could go for your normal size but i liked it a little more fitted and ended up getting a small. i plan to wear it over jeans or leggings. the delicate embroidery and details are so pretty. the stick out sides look a little funny but if
2309	3	a	"This top fits like shown in the pictures. however, i bought the rose color and thought it was a little ""off"". would have loved to find the ivory in my size."
2310	4	a	I got size 2p. it comes down a little over my knee cap and i wish it was rather a little above it. i have a small chest about 32b and with a padded push up bra it was still bit loose on the top. i do have a shorter torso. i feel like i could've gone with the 0 petite. i'm a pear shape and more like a size 4 on the bottom and i weigh about 115lbs- there is tons of room to go smaller - it is not form fitting on the bottom at all. has that slight polyester feel but the fabric is beautiful and thick
2311	5	a	Great long cardigan! i wear this with a simple tank
2312	5	a	I can't get enough off-the-shoulder tops. so even though this is out of season, i went for it...in both colors! my only con is the fabric has a slight sheen which cheapens the look a tad. like i'd read in other reviews, it does run a bit small for this cut top - i just wanted a bit more volume in the neck hole and in the waist since i won't be tucking in. if you want it more fitted and ruched around the waist, go for your normal size. i'll be ordering a small in both colors because i know i won'
2313	5	a	This pullover is a great purchase. the color is simply stunning and is very comfortable.
2314	5	a	I absolutely adore this top! it is super soft. i purchased it in the wine color. i would recommend this for anyone! if they have other colors i plan on buying them. i am going to wear this with jeans and my furry vest in the fall/winter.
2315	5	a	If i could wear this top every single day, i would. this is the white flowy top i've been dreaming of; but better! the fabric is so lightweight and breathable. i can wear this on a cool spring night with a scarf, skinny jeans & ankle boots, or on a hot summer day with shorts/skinnies and sandals. you can dress it up or down. be aware that the chest hem is at a non-traditional height; not quite above or below the breasts. however, i think it looks flattering on both small-chested and busty women.
2316	5	a	"I usually wear a size small in deletta. i am 5'5"" and 140 pounds. the small ran true to size for me. saying that i am a size 8 so usually everywhere else i can take small or medium, so i can see how reviewers say it runs big. love the ruffles on this tank. makes it a little more special. super comfy and easy to wear. will be great for hot summer days in florida!"
2317	5	a	This was surprisingly more complimentary and easier to wear than i though it would be. i love vix bathing suits and the quality is exceptional!
2318	5	a	Gorgeous lace detail on this classic swimsuit. absolutely love it! fits true to size.
2319	4	a	I have the t shirt from last year and i love it so could not wait to try the dress. why didn't you make it in petite? it can work with some tailoring but petite sizing esp since this runs on the big side, would have been ideal. love the navy, will try the white. how about some more colors and petite?? please??? more t shirt dresses in general too please!!
2320	5	a	I'm a 34c and 136 lbs. i bought this jacket in m and it fits perfect! the sleeves are just the right length, it fits through the chest and hips. the leather and other material is super soft! i love the dark brown color, it's just as pictured. like someone else said, you can tuck the hanging material inside the jacket for a sleeker look. this is my new favorite jacket!
2321	5	a	"I'm 5'7"", 120 lbs, size 0 was best.  ordered the green color.  great flattering fit!"
2322	5	a	This skirt is gorgeous. i'm glad i saw it in-store as the picture online does not do it justice. the colors are really rich and the pattern has a sentimental, vintage feeling. it also has pockets and a great, glamorous swing to it. this skirt is great for work with a blouse and heels and also looks awesome with a t-shirt tucked in and sandals. the fabric has a really nice four season weight, i think it will also look great with high boots and a turtleneck in the autumn. i get so many compliments
2323	5	a	"This is a beautiful dress. it fits true to size. i have some issues around the middle and this just flows away from the body. i am 5'5"" and it falls to the knee on me, longer than pictured on the model. the fabric is a nice weight that can be worn three seasons. the print is pretty and romantic. i'm planning to wear this to my daughter's very informal wedding and know i'll be comfortable and look put together. this was a lucky find!"
2324	5	a	Gorgeous dress! fits true to size with high quality material. the colors are stunning.
2325	5	a	"Absolutely perfect and worth every penny! i am 5'8"" and normally between a 4 and 6 in jackets. while the small fit, i ended up purchasing a medium so i had more room in the arms. insanely comfortable and truly stunning on. expect compliments when you are wearing it!"
2326	4	a	"I bought this top in both colors. the fit is perfect, the styling is very cute and it also is very comfortable!! the only bad thing is that it snags on my jewelry !! :(. if it weren't for that i would rate it a 5!!"
2327	5	a	I'm very picky about jumpers, and this one is abolutely perfect! i love how it looks like a dress at first glance. it runs a little big because of the oversized fit it is supposed to have, i sized down because of the armpit area. nude garments and you'll be fine. this is going to sell out fast, don't wait for it to go on sale! (seriously my store is already out of xs's)
