729	5	a	"I love workout dresses and skirts. i sport them in both yoga (if they have an under layer of shorts, obviously) and in high cardio classes-as well as for things like tennis. i like the extra breeze a dress/skirt will get you, and find them to be really comfortable. i really like this dress as it is not a super bold color (it is hard to find workout attire that is not neon colored). i prefer things to be a little more relaxed and less ""look at me"" like when i am working out. this dress is flatter"
730	5	a	This top is so comfortable and better quality than i expected. ruffles fall nicely over your sholulder and there is a fabric underarm, i don't have to wear a tank top underneath like i normally would with tops with wide opening around arms. color is beautiful too, i really love it. true to size.
731	3	a	It's a pretty top with a lot of intricate detail and love the edge the studs give it but it looks fuddy duddy in ivory. looks nicer in black but you loose some of the detail in the dark color. the lace is not soft either but has more of a polyester, slightly scratchy feel. sizing is true to size and it fits well if the style floats your boat.
732	2	a	"I ordered the black & white, 00 petite. i'm 5' 2"", 96 lbs. and i order petite sizes all the time. the length for the size i ordered is about 23"" (on the back, from neckline) which is great for me; however, the length on the sides is way too short. the distance between the armpit on the blouse and the side hem is only 9.25"", so my skin shows on the sides all the time when wearing regular jeans. not at all the way it shows on the model. i would order 00, regular length, but then the sleeves will b"
733	5	a	Runs a little small, but is very chic!!! you can wear it with jeans and a white t-shirt and you are going to look awesome!!!
734	5	a	I love this sweater! it does run a little large though. fits beautifully. great for cool summer nights and early fall. dress up or down.
735	5	a	Got so many complements! really comfy but runs big! i'm usually a large and i wish i had gotten the small.
736	3	a	Runs very big.  i ordered a l and need a m.  unfortunately no medium left!  great top with lots of character. hate i missed this cute top
737	4	a	I bought the holly color which appears almost granite/slate color in natural light. overall, great transitional sweater piece for fall. i'm considering exchanging it for an xs since the s seems a bit large. comfy/cozy yet breathable.
738	5	a	I purchased the pale green in this sweater first. loved it so much i purchased in another color.
739	5	a	I ordered a size down as the reviews suggested and i love them!! they are so cute and snug enough in the calf that i can wear boots with them in winter.  great buy!
740	2	a	I've been wearing this very comfortable and cute coat for 2 weeks. it is already tearing at the seams somehow. the quality of this is very poor.
741	3	a	This t is a beautiful color, and i wish it had worked. it is quite flimsy, however - very thin cotton fabric, without the nice drape that would have made this look good on. i also think it should have been cut a little longer; it flares out right at the hips,so instead of covering them, it highlights them. i'm disappointed, and am returning it.
742	4	a	"This jumpsuit is fabulous in person! it is elegant and easy and very figure flattering. i have a very curvy shape but a 34 ddd bust so i would say i am a top heavy hourglass. this jumpsuit does me right. the only thing i would say is i don't think it would be very comfortable on a person with a long torso. i am 5'3"" and bought this in 6 regular and the length is perfect with heels. but the whole top half fits me perfectly but shows alot of boob if i'm not careful. but i don't think it would be s"
743	3	a	I expected better from this top, it is thin, will snack easy, and you have to wear a cami underneath. for the price, not worth it. definitely returned!
744	5	a	Count me in as a five star lover of this dress! the details are so rich and interesting, so be prepared to get noticed when wearing. i'm happy to say that getting the size medium regular (instead of petite) was a good choice for my top heavy frame. the chest is fitted but not tight, the length is a not-too-short above knee, the tiered layers swing so nicely, and the beads/sequins add a touch is whimsy to the design. my one negative is the tassels at the neck tie--soo heavy cumbersome to style. o
745	1	a	Very disappointed. the cutouts started to rip the first time i wore it. i've only worn it twice and i love it but the cut outs are embarrassing.
746	5	a	"I'm 5'5"" 120 lbs and bought this in size medium because i have long arms and was afraid that the cashmere would shrink even if i hand-wash and dry flat (because let's be honest--i doubt i'll ever send it to the dry cleaner). it's loose through the body and arms, but the sleeves are the perfect length. the term ""bell sleeve"" is no exaggeration. the sleeves are billowy and voluminous and i can see them getting in the way while washing my hands or doing dishes. i guess i will have to reserve this s"
747	3	a	"Looks nice and i did like the button detail on the collar. colors are nove and the feel is soft. i would probably have to get a petite smaller size."
748	3	a	"The fabric on this shirt was beautifully woven and so soft/cozy. but the shirt was so wide! i'm 5'2"", 103lbs and got an xs. there was room for two of me in there. it draped very well, but instead of looking slouchy and cool, it just looked too big. so, back it goes."
749	4	a	I took this in a large. im a 36d 140lbs. this top in a large fit me perfectly without a bra. slightly see through but not by much... i haven't tried it with a bra on yet, but im sure it'll be just fine.
750	3	a	This would have been a perfect jacket for a trip i'm taking, light weight and very stylish. however the jacket runs huge, the arms are long but it was the shoulders that were too big. i wear a size 8-10 mostly 10 in retailer clothes i ordered the large and the shoulder seam was about 2? past my natural shoulders. i won't return for a smaller size because the fabric being wool (i should have checked) its unbearably itchy esp around the neck, you could wear a long sleeve top and a scarf but then it
751	5	a	Love the detailing around the neck of this top looks great under cardigan or by itself. i sized down to an xs. seems to be of good quality although to lengthen its life i don't plan on putting it in the dryer :)
752	5	a	Really cute fun print. nice summer dress..
753	5	a	Such cute, soft and comfortable shorts. can be worn as night wear or out and about.
754	4	a	"I purchased this shell in black. the embellishments and construction of the top are of a good quality, like as shown. i am 5'4"", 120# and typically purchase an xs. this ran a bit bigger than i was expecting from the reviews, but i am overall happy with the top. the center slit may be too revealing for those with a smaller bust."
755	2	a	While you can't count on the photo on your monitor to portray the exact color of an item, these photos are way off.  instead of the warm charcoal i see online, the pants are more of a dusty blue.  the material has very little stretch and i couldn't get into the size 24s.  the 25s were tight in the entire leg but huge in the waist.  for reference i usually wear a size 24 in brands like 7 for all mankind and citizens of humanity.
756	4	a	I saw a review from another petite person who said this runs small, but i'm my case it ran true to size. it's a very flattering dress and easy to wear for any occasion.
757	4	a	This is my 4th pair of these printed cords and they are beautiful- the color says navy but these are definitely black with a grayish print. very stretchy all over except for the waist band which is a little uncomfortable but it might loosen up some. i wish the rise on these was a little higher. also worth noting is that the design on larger sizes won't look exactly like the picture- my size 33's have the floral scroll print up the front and the back, but also the cut has the scroll print running
758	3	a	I wanted to love this top. i really did. the color is beautiful, the embroidery is well done, the fabric is soft, and it feels like it would be very comfortable in the summer heat. but the armholes are big and so the holes show my bra which is not good. i guess i could wear a bandeau or tank underneath, but the armholes just kind of ruined my love for this top. i think i will try again and order next size down.
759	5	a	"This beautiful, soft, swingy, dress is oversized on me.  usually when someone reviews that a dress runs large but their body type is opposite mine, i pick tts and 90% of the time i'm right.  not so in this case. the outer dress is very wide and the amazing super stretchy under slip is too large also.  debating on sizing down because of potential shrinkage after laundering.  i bought m and my stats are 5'3"" 140# 39/28/35.  dress ends just above my knees.   agreeing with the previous reviews th"
760	5	a	"I love these pants, they are a great addition to my work wardrobe. the fit is very flattering, with the wide legs falling perfectly, and they are a great length. i got the red, which is a beautiful and brighter than the pics. the fabric is a nice weight, perfect for fl winters. i personally like the mid-rise as it helps with tucking in shirts that are on the shorter side. i highly recommend these pants as a nice alternative in color and cut for the office. i'm 5'7"" and 135lbs and i purchased the"
761	5	a	Love the fabric. comfortable to wear with jeans or a dress. good for those cool fall mornings.
762	5	a	"I love this shirt. i actually bought two in black (my ""uniform""), then decided to order one in white as well. however, the white shirt fit differently than the two black ones! it was significantly shorter; over 2' shorter! while the black tee is the perfect length, the shorter white version wasn't flattering on me and kind of flared out around my waist...not the best look. that being said, i know the black shirt will be in heavy rotation for a while, and the people at retailer were very und"
763	4	a	This is a cute, fun addition to my wardrobe, especially since i am a polka dot fan! it is alittle short for me and i think it runs just a bit small, particularly if you want to wear like the model with longer shirt under it. overall, it was worth the sale price and will look good with casual pants, jeans and with dressier black pants for work.
764	5	a	If you're on the fence about this dress - go for it! i am a huge retailer shopper but haven't ever been compelled to write a review until now.  this dress fits beautifully.  the materials is so soft and comfortable and the design of the dress is very flattering, with or without a belt.  i am 5'2, 118 pounds and i purchased the pxs. it's perfect!  i wore this with booties and received a ton of compliments. the fringe and hemline make this dress really stand out.
765	5	a	I saw this top on a store mannikin and was drawn to it by it's color and print. it looked great with blue jeans on display and a lariat necklace. then i noticed the different design on the back below the yoke. the surprise was its being pleated into very fine pleats. i liked the funky quality this added. the design is a good transitional piece to wear early fall or under a jacket. it is machine washable and that finalized the purchase of it. i bought the necklace too. i often wear a small but go
766	5	a	Love this top. have two of them. they are comfy, light-weight and extremely flattering. love!
767	2	a	This dress was adorable & fit great! regrettably, i had to return it since it wasn't lined.
768	1	a	This top is quite boxy and i was very disappointed with the color, it looked as if i'd washed it in filthy water. it's a very dingy white, needless to say it went back.
769	5	a	Love love this! i was hesitant to buy this at first - the reviews made it seem so big and i wasn't sure if it was my kind of outfit. but i wanted to try a jumpsuit and this was the perfect find! the xs was a typical retailer size for me, so the size was good in this, too. the color is fabulous and the fit is great. the rise is slightly short, but not a problem. i can't wait to where it for my next great event. i wish i could buy it in the black, too.
770	5	a	Love these soft cozy leggings. fit like a glove. perfect for weekends, lounging, sleeping during cold winter weather. want more of the same!
771	4	a	"I have not a actually purchased this coat yet but was able to try it on at my local retailer. thought i'd pass along a couple of details the description is missing. the coat is not lined. i have regular length arms and the sleeves are a bit short, not quite 3/4 length but not long enough to keep my wrists warm. also, i was afraid the red would be more orange, it is a very pretty red. it also runs a little big. i am 5'4"" medium, athletic build and would probably consider a m but it seemed bi"
772	3	a	"I love the fabric and pattern of this dress so much that i decided to keep it (got it on mega sale), but i would have never paid full price or anything close. the armholes are enormous, showing bra and all. i am not particularly large chested (34c), and the buttons are stretched to gaping on me, even with the huge armholes. i have a cute red sweater coat that i will wear over it all fall, but i could not recommend it because of the poor cut design.  pros: great pattern, fabric, pockets, true to"
773	3	a	This dress is beautiful as pictured on the model. but on me, not so much. i am normally a size 0/00 with a 32b bra size. i ordered this dress in an xs and it was just too big and boxy. i also thought the material was going to be thicker, but it was very thin and didn't seem to fall right on my body. beautiful design, just not the right material or fit.
774	4	a	"I have worn this with skinny jeans and espadrilles untucked and with black linen shorts. i also wore tucked in with high waisted slim fit black pants,  i got compliments on all the looks. i think it's a fun and cheerful, feminine summer top.  i got mine on sale so i thought was a fair price for what it is. wouldn't have paid full retail.  requires ironing.  i am a size 4 and 5'3 and have a small."
775	4	a	Never spent this much on a dress so it needs to be amazing for me to keep it.  i've never seen flannel patterns and colors like this. the details in the back are unique. but in the end, i decided to return because it's too long and although it fit fine in a size large it didn't look that great on me. the dress has an exaggerated drop waist that was too low for my short waisted frame. the fabric smells odd. i tried belting it but the pockets and back buttons created bulk.
776	2	a	I'm normally a size 25p. i bought these in a 26 because i wanted a more relaxed fit. i could barely pull them up over my calves. i could get them on and button them, but i felt like a sausage stuffed into a straw. size up 2 sizes at least!
777	3	a	I was excited to see this offered by retailer because i have been looking for a light blue summer jacket or blazer that isn't a denim jacket and this seemed to fit the bill. i've ordered several cartonnier blazers in 00p, as early as 2013 and as late as spring 2015, and have been very happy with them. on the plus side i would say that the color is depicted accurately and it does seem like a high quality jacket. but while the shoulders and sleeves were a pretty standard fit for 00p, it was much too
778	5	a	Perfect fit, great material, torn in just the right places. can't wait to see the stevie jeans for the fall esp. in corduroy!
779	4	a	I tried on the blue in store and ordered the red in petite, and they are both too long (which means i will have to hem). i am not sure if i want to spend the extra money on hemming so hanging on to them for now as i love hte cut and color. they fit like a glove otherwise (i do have muscular thighs). the 0p is good for me (115 lbs). can't go wrong for a nice pant, i can see wearing these out or for work...
780	2	a	"I love jumpsuits for their style and comfort. i loved the look of this blue silky piece, and the review that said it was like lounge wear you could wear out of the house. i agree that it is like lounge wear, but for me, there were a few challenges.  first, the fit was small. i am usually anywhere between a 2 and a 6 depending on style, cut and brand. i tried the small in this and it was not a flowy look or feel. it was restrictive in the hip area in a way that would make me not want to wear th"
781	5	a	I wore this top recently and received several compliments. it's a great top with the off the shoulder trend, plus you can wear a normal bra underneath! runs large so i recommend one size down.
782	5	a	This is a great shirt with cute details including the ruffled back. i am petite and needed to shorten the sleeves, but otherwise the fit was true to size and not too baggy or too tight. the material feels avergage in quality, but looks polished with navy blue pants. i received several compliments during my first wear. overall, a very cute shirt!
783	2	a	"This is a beautiful spring/summer dress, and the quality of the materials is great. i wanted to love it. but the sizing is ridiculous! i'm 5'3"" and 115 and i think you could fit three of me comfortably in the xs. while the pictures of the model in the dress don't suggest it has a shapeless cut, it definitely looked like a sack on me. a sack with a lovely print, but still an ill-fitting sack."
784	5	a	As the other reviewers stated, it does run large, i sized down 1 size and it's perfect. great dress to wear so many ways.
785	4	a	Love the colors and design of this lace-printed top but didn't realize it's not lined. the description says its polyester lace with polyester lining so i assumed it was lined and when you look at the photos, there is a lining under the top. the arm holes are slightly cut-in both front and back so it will be rather difficult to find a camisole with thin straps with a similar cut so they don't show. other than that, it's a beautiful, unique summer top.
786	5	a	"Although this isn't a soft top, i didn't find it that scratchy or bothersome at all. it's 55% linen! and, for linen it's soft. it's also got tons of stretch which makes it very comfortable as far as movement.   i bought the black, and i do not find this sheer or see-thru. it's a light thickness which makes it perfect for layering under a jacket or sweater for a cool spring or warm fall day. i found it running tts, with the sleeves and length a little long (i'm petite) making perfect for the av"
787	5	a	This dress is great for hiding any insecurities. it's also very comfy.
788	3	a	I purchased this for a very good price and i typically love maeve... should have been a win-win. the fabric is thin and slinky in the most unfortunate way. it made finding appropriate undergarments very difficult. i had to add a slip (that helped) and figured that since i'm losing weight, it would look better when i'm down a few more pounds. that being said, i didn't find it to be figure flattering. i have a tummy and there was at least one photo from the bridal shower i wore this to, where i lo
789	5	a	Love the print of this fabric & the length. the buckles at the waist add a unique look so no belt necessary.
790	5	a	I absolutely love this tank. it goes great with a pair of jeans and cute booties. great colors and material. i love the nigh neck.
791	3	a	"I'm still on the fence about these. i realize they got great reviews but i thought they would be a bit thicker. they just feel too flimsy and too much like i'm ready for bed. i was looking for more lounge pants that i felt like if i needed to run up to the store on a saturday afternoon that i wasn't wearing pjs. i just can't get past that. they are totally cute but i was definitely looking for more summer lounge-wear.  i ordered the small which fit fine. i wear 4-6 in retailer pants. i got the p"
792	4	a	These pants are really cute but definitely run small - i ordered a large so they would be a little bigger for lounging and they are not very stretchy. the large fits more like a small in regular sweatpants. there is more blue visible in the top and bottom part of the pants as well, which i like.
793	5	a	"I found this at my local store and ended up buying both colors. the fabric is thicker than a t-shirt. these will go with so many things....jeans to dressy skirts. i normally wear a small but ended up buying the medium (2). the small fit me but was a little too short (for reference i am 5'8""). these will be a staple in my wardrobe all year round. love!"
794	3	a	I absolutely loved these pants the first several times i wore them. the fit is flattering, they are a perfect long length, and the colors are stunning. after several wears, it was time to wash them and i followed the directions provided to wash with cold water and line dry. i was initially horrified with the amount that these pants shrunk in fit and length and the colors ran together. after a lengthy ironing session, i was able to smooth out the material and restore much of the length and fit bu
795	4	a	Great fabric, not too clingy and provides a forgiving sillhoette. very comfortable. perfect skirt for summer get togethers or shopping. may be a little long if you are on the short side. one thing i liked is that the skirt draped well and doesn't hang open or slide up. recommend particularly on sale.
796	5	a	I cannot believe how different this top looks in person. i purchased this in the store and fell in love with it immediately. viewing the pictures on here does not do the top justice. it is very form fitting and compliments large busted women. the cut is not too low and lays beautifully.
797	4	a	This jumper is adorable and very well made! it is a bit tight in the ankles and it kind of gives me a hungry bum look but then i realized i ordered a 4p so it is actually tts. going to preview this number at my bachelorette party!
798	5	a	"I really love this piece. it's so different from anything else i own! the material has a lot of fine details to it that are hard to see in the photos. easy to dress up with a bit of jewelry and heels. the only downside is the upper body fit. i'm 5'6"" and 130 lbs with more of an hourglass shape. i did not fill out the top at all, although the shorts fit fine around my waist."
799	4	a	This would be one of my favorite shirts if the neckline were straight across instead of cut, or if it at least had a button. it runs large so the low neck plus bagginess makes it feel too loose for my taste, even though i ordered the xs. the back of the sweater is also really long. it's a comfortable fabric and nice quality though.
800	4	a	"I ordered the small and it fits ok,i probably could have went with an xs but i am keeping the dress.it is a very beautiful dress.this dress can be worn for casual or dressed up for evening.very versatile dress and well made.i did get it on sale which made it very affordable. i am only 5'3"" and the length in the regular s is fine for me."
801	2	a	"On me, thsi was ginormous, looked like a mu mu. it is pretty, but there was just too much fabric, even in the smallest size. the quality seems nice, and it looks pretty, but overwhelming. i will say, i think it would work on tail lean people, i have pretty muscular shoulders, so the off shoulder look with that much fabric made me look 30 pounds heavier, no joke. fabric is soft though. give it a try, just not for me...  ref: 115 lbs, 30dd, 26.5 in waist."
802	4	a	I love these pants! i got the blue ones. i got a petite 25 and i am 115lbs 5.1.5' - they sit low on waste and hug curves just right. they are little bit long, maybe 1 inch too long. will wear with platform or thick squared heel.
803	5	a	"I've been trying on ""boyfriend"" jeans for more than a year, finally found a pair that fit and were comfortable. many of them had no stretch at all and were very uncomfortable. these have just enough stretch, but not too much. i usually wear a 29-30, tried on the 29 which were comfortable but too loose at the waist. the 28 were a perfect fit. i'm 5'8"", 140lbs."
804	2	a	"After reading the reviews, i had high hopes for this dress but was disappointed that it wasn't flattering on me.  i'm 5'4"", 126 pounds and generally wear a size small, but the small of this dress looked more like a maternity outfit on me. it squeezed the bust a bit too much, and left open some of the areas just under the arms that could probably have used a teensy bit more coverage to be truly flattering."
805	5	a	Incredibly soft and comfortable, not as fitted as i would like (this often happens to me with skinny pants, though). i want to wear these guys everyday!
806	5	a	I bought this top in white. i wore it with black skinny crop jeans. it is very cute and flattering. the length is just so that it makes the swing top flattering without is bring too overwhelming. i received lots of compliments. the quality is great and the top washed up well too. love it. for reference. i'm 5'5' 125 lbs and bought the top in small.
807	4	a	"The beautiful bold print drew me to this top and it did not disappoint upon receipt. however, the bottom ruffle belled so far out on each side that it was laughable! the actual fit is nothing like the picture; clearly the model's arms are placed in front of all the extra fabric to hold the ruffle back. however, the fabric is beautiful, the fit was perfect (size 2, 5'4"", 106 lbs.), the quality is great and i love the print so i decided to take it to my tailor to ""sew away"" the ""wings"" on both si"
808	4	a	Pants were super comfortable. a little too large. and the fabric was a little too heavy. i sent them back, and i'm regretting it now that they're completely unavailable.
